{
  "$schema": "../region-pack.schema.json",
  "region_id": "de-by-deggendorf",
  "pack_version": "0.1.0",
  "taxonomy_version": "1.0.0",
  "updated": "2026-08-01",
  "status": "draft",

  "name": "Deggendorf",
  "country": "DE",
  "admin_path": ["DE", "BY", "Niederbayern", "Landkreis Deggendorf"],
  "default_locale": "de",
  "bbox": [12.8850, 48.7900, 13.0350, 48.8850],
  "geohash_tiles": ["u2853", "u2856"],

  "operator": {
    "name": "ZAW Donau-Wald",
    "url": "https://www.awg.de/",
    "note_key": "region.de_by_deggendorf.operator_note"
  },

  "sources": [
    {
      "title": "ZAW Donau-Wald – Mülltrennung (Restmüll, Papier, Bio)",
      "url": "https://www.awg.de/nachhaltigkeit/muelltrennung",
      "retrieved": "2026-08-16",
      "verified_by": null,
      "note": "The operator's own separation guidance. Names exactly three household bins – Restmülltonne, Papiertonne, Biotonne – and lists what belongs in each. It states no container colours at all, so the lid_color half of every wheelie rule below is still uncorroborated."
    },
    {
      "title": "ZAW Donau-Wald – Was entsorgen? (waste-type directory)",
      "url": "https://www.awg.de/abfallentsorgung/was-entsorgen",
      "retrieved": "2026-08-16",
      "verified_by": null,
      "note": "Per-material directory. Confirms glass is separated by colour (weiße / grüne / braune Glasflasche each have their own entry) and that Altkleider are collected separately."
    },
    {
      "title": "ZAW Donau-Wald – Kunststoffverpackungen",
      "url": "https://www.awg.de/abfallentsorgung/was-entsorgen/kunststoffverpackungen-sonstige-verpackungskunststoffe",
      "retrieved": "2026-08-16",
      "verified_by": null,
      "note": "CONTRADICTS the two packaging rules below. This operator routes plastic packaging to a Wertstoffinsel, not to a Gelber Sack or a Gelbe Tonne. See the verification notes."
    },
    {
      "title": "ZAW Donau-Wald – Altkleider",
      "url": "https://www.awg.de/abfallentsorgung/was-entsorgen/altkleider",
      "retrieved": "2026-08-16",
      "verified_by": null,
      "note": "Separate textile collection exists in this jurisdiction. The container form factor is not described."
    },
    {
      "title": "ZAW Donau-Wald – Wo entsorgen? (facility map)",
      "url": "https://www.awg.de/abfallentsorgung/wo-entsorgen",
      "retrieved": "2026-08-16",
      "verified_by": null,
      "note": "Facility types: Deponie, Recyclinghof, Wertstoffinsel, Grüngutannahmestelle. The Wertstoffinsel is the unit this pack's glass and packaging rules should be describing."
    }
  ],

  "rules": [
    {
      "id": "deg-residual-wheelie",
      "match": { "form_factor": ["wheelie_small", "wheelie_large"], "lid_color": ["black", "grey"] },
      "stream": "residual",
      "local_name": "Restmüll",
      "confidence": 0.90
    },
    {
      "id": "deg-paper-wheelie",
      "match": { "form_factor": ["wheelie_small", "wheelie_large"], "lid_color": ["blue"] },
      "stream": "paper",
      "local_name": "Papier / Papiertonne",
      "confidence": 0.94
    },
    {
      "id": "deg-bio-wheelie",
      "match": { "form_factor": ["wheelie_small", "wheelie_large"], "lid_color": ["brown"] },
      "stream": "bio",
      "local_name": "Biomüll / Biotonne",
      "confidence": 0.92
    },
    {
      "id": "deg-packaging-sack",
      "match": { "form_factor": ["sack"], "body_color": ["yellow"] },
      "stream": "packaging",
      "local_name": "Gelber Sack",
      "confidence": 0.95
    },
    {
      "id": "deg-packaging-wheelie",
      "match": { "form_factor": ["wheelie_small", "wheelie_large"], "lid_color": ["yellow"] },
      "stream": "packaging",
      "local_name": "Gelbe Tonne",
      "confidence": 0.88
    },
    {
      "id": "deg-glass-igloo-generic",
      "match": { "form_factor": ["igloo"] },
      "stream": "glass_mixed",
      "local_name": "Glascontainer",
      "confidence": 0.55,
      "requires_disambiguation": true,
      "disambiguation": {
        "prompt_key": "disambiguation.glass_color",
        "options": ["glass_clear", "glass_green", "glass_brown"],
        "note_key": "disambiguation.glass_color.note"
      }
    },
    {
      "id": "deg-glass-igloo-clear",
      "match": { "form_factor": ["igloo"], "body_color": ["white", "transparent"] },
      "stream": "glass_clear",
      "local_name": "Weißglas",
      "confidence": 0.80
    },
    {
      "id": "deg-glass-igloo-green",
      "match": { "form_factor": ["igloo"], "body_color": ["green"] },
      "stream": "glass_green",
      "local_name": "Grünglas",
      "confidence": 0.80
    },
    {
      "id": "deg-glass-igloo-brown",
      "match": { "form_factor": ["igloo"], "body_color": ["brown"] },
      "stream": "glass_brown",
      "local_name": "Braunglas",
      "confidence": 0.80
    },
    {
      "id": "deg-textiles",
      "match": { "form_factor": ["textile_bank"] },
      "stream": "textiles",
      "local_name": "Altkleidercontainer",
      "confidence": 0.90
    },
    {
      "id": "deg-street-basket",
      "match": { "form_factor": ["street_basket"] },
      "stream": "street_litter",
      "local_name": "Papierkorb",
      "confidence": 0.93
    }
  ],

  "local_names": {
    "residual": "Restmüll",
    "paper": "Papier",
    "bio": "Biomüll",
    "packaging": "Gelber Sack / Gelbe Tonne",
    "glass_clear": "Weißglas",
    "glass_green": "Grünglas",
    "glass_brown": "Braunglas",
    "glass_mixed": "Altglas",
    "textiles": "Altkleider",
    "ewaste": "Elektrokleingeräte",
    "batteries": "Altbatterien",
    "deposit_return": "Pfandrückgabe",
    "bulky": "Sperrmüll",
    "hazardous": "Problemabfall",
    "street_litter": "Papierkorb"
  },

  "overrides": {
    "packaging": {
      "note_key": "region.de_by_deggendorf.packaging_note",
      "accepted_add": [],
      "rejected_add": []
    }
  },

  "collection_schedule": {
    "status": "not_implemented",
    "note": "Schema reserved for v3. See docs/07-roadmap.md. The shape is intentionally present so that region packs do not need a breaking version bump when schedules land.",
    "streams": {}
  },

  "notes": [
    "DRAFT, and it must stay draft. Rules were transcribed from the predecessor project's four hard-coded classes plus general German practice – they are a starting point, not a verified source. Every source now carries a URL and a retrieval date, so RegionPack.is_publishable is true; that means the SOURCING bar is met and nothing more. `status` is the guard that keeps this away from users, and only a human who has checked the rules against the operator may move it.",

    "VERIFICATION PASS, 2026-08-16, against the ZAW Donau-Wald sources listed above. Read this before trusting any rule here. Corroborated means the operator's own page says the stream exists and is collected separately; it does NOT mean the colour or the form factor in the `match` was confirmed. No source consulted states a single container colour, so the lid_color and body_color halves of every rule below remain unverified across the board.",

    "CORROBORATED (stream exists, separately collected): deg-residual-wheelie – Restmülltonne is named explicitly. deg-paper-wheelie – Papiertonne is named explicitly. deg-bio-wheelie – Biotonne is named explicitly. deg-textiles – Altkleider have their own directory entry and a separate collection.",

    "CONTRADICTED, and this is the important one: deg-packaging-sack and deg-packaging-wheelie. Both assert a kerbside packaging collection – a Gelber Sack at confidence 0.95 and a Gelbe Tonne at 0.88 – and the operator's own page for Kunststoffverpackungen routes packaging to a WERTSTOFFINSEL instead. Neither rule was corroborated and both are actively disputed by the source. They are left in place rather than deleted because removing a disposal rule is the maintainer's call and because ZAW Donau-Wald covers a whole district, so a yellow sack may still exist in some municipality within it – but on the evidence gathered here these two rules would tell a user in Deggendorf to use a container that is not collected. They must be resolved before this pack leaves draft.",

    "UNCORROBORATED (plausible, no source found): the four igloo rules – deg-glass-igloo-generic, -clear, -green, -brown. The directory does confirm that glass is separated by colour (weiße, grüne and braune Glasflasche each have their own entry), so the three-way COLOUR SPLIT is real; what is unverified is that the container is an igloo and that its body colour indicates the glass colour. deg-street-basket – no source consulted covers street litter baskets, which are usually the municipality's rather than the waste authority's.",

    "Deggendorf household setups observed by the original project: residual and paper bins next to houses, sometimes inside a locked shed; glass only at communal banks, typically near offices or larger buildings.",

    "Glass banks are the known hard case. The predecessor's deck names Glas as 'the biggest problem'. Body colour alone is unreliable because many banks are a uniform green shell with per-aperture colour coding – hence requires_disambiguation on the generic rule until aperture detection lands in v2. The operator calls the unit a Wertstoffinsel, which is a SITE holding several containers rather than one container; a pack that models it as a single igloo is describing the wrong object, and that is worth settling before phase 6 tries to add a second city on top of this abstraction."
  ]
}
